sample_size,pair_id,intervention,target,identifiable,runtime_seconds,estimand_length,estimand,error_message
5,1,ihfA,def,False,27.380292892456055,,,"Cannot identify P{def} | do{ihfA})). District frozenset({fis, rcsA, cspA, bolA, lrhA, gadX, ompR, ihfB, csgD, rpoE, argR, fliA, slyA, mqsA, sdiA, rpoH, cra, glnG, torR, rstA, rpoS, rcsB, gadW, rpoD, rutR, hns, nac, bglJ, lrp, sutR, evgA, ydiP, rpsA, lexA, flhD, cytR, yjjQ, adiY, matA, rpoN, flhC, soxR, dnaA, stpA, leuO, gadE, deaD, oxyR, lldR, fliZ, csrA, qseB, fnr, argP, fur, soxS, phoP, ydeO, dksA, crp, acrR, arcA, zraR, mlrA, phoB, hdfR, cpxR}) failed identification."
5,2,phoB,ppiB,False,16.975003242492676,,,Cannot identify P{ppiB} | do{phoB})). District frozenset({argP}) failed identification.
5,3,soxR,ulaF,False,44.41374659538269,,,"Cannot identify P{ulaF} | do{soxR})). District frozenset({ihfA, fis, rcsA, cspA, bolA, lrhA, gadX, ompR, ihfB, csgD, rpoE, argR, fliA, slyA, mqsA, sdiA, rpoH, cra, glnG, torR, rstA, rpoS, rcsB, gadW, rpoD, rutR, nac, hns, lrp, bglJ, sutR, evgA, ydiP, rpsA, lexA, flhD, cytR, yjjQ, adiY, matA, rpoN, flhC, dnaA, stpA, leuO, gadE, deaD, oxyR, lldR, fliZ, csrA, qseB, fnr, argP, fur, soxS, phoP, ydeO, dksA, arcA, crp, acrR, zraR, mlrA, phoB, hdfR, cpxR}) failed identification."
5,4,bglJ,ybhI,False,23.47080373764038,,,"Cannot identify P{ybhI} | do{bglJ})). District frozenset({ihfA, fis, rcsA, cspA, bolA, lrhA, gadX, ompR, ihfB, csgD, rpoE, argR, fliA, slyA, mqsA, sdiA, rpoH, cra, glnG, torR, rstA, rpoS, rcsB, gadW, rpoD, rutR, nac, hns, lrp, sutR, evgA, ydiP, rpsA, lexA, flhD, cytR, yjjQ, adiY, matA, rpoN, flhC, soxR, dnaA, stpA, leuO, gadE, deaD, oxyR, lldR, fliZ, csrA, qseB, fnr, argP, fur, soxS, phoP, ydeO, dksA, arcA, crp, acrR, zraR, mlrA, phoB, hdfR, cpxR}) failed identification."
5,5,glaR,yehW,True,33.40798616409302,17522.0,"Sum[acrR, adiY, alpA, arcA, argP, argR, basR, bglJ, bolA, btsR, cpxR, cra, crp, csgD, cspA, csrA, cytR, deaD, dksA, dnaA, evgA, fis, flhC, flhD, fliA, fliZ, fnr, fur, gadE, gadW, gadX, glnG, glrR, hdfR, hns, ihfA, ihfB, leuO, lexA, lldR, lrhA, lrp, matA, mlrA, mqsA, nac, nsrR, ompR, oxyR, phoB, phoP, ptrR, qseB, rcdA, rcsA, rcsB, rpoD, rpoE, rpoH, rpoN, rpoS, rpsA, rstA, rutR, sdiA, slyA, soxR, soxS, stpA, sutR, torR, ydeO, ydiP, yjjQ, zraR]((P(abgA, abgR, acnB, acrE, acrF, acrR, ada, adeP, adhP, adiA, adiC, adiY, aer, agaR, agp, alaA, alaE, alaS, alaX, allR, alpA, alsR, ameF, amiC, amn, ampC, ampD, ampE, ampH, amyA, apaG, aphA, arcA, arcB, arfB, argA, argD, argE, argG, argH, argK, argP, argR, argV, argW, argX, argY, argZ, arnA, arnB, arnC, arnD, arnE, arnF, arnT, aroA, aroB, aroE, artP, artQ, asd, asnV, aspC, aspS, asr, astA, astD, atoA, atoC, atoE, atpA, atpB, atpD, atpF, atpI, azoR, azuC, bamB, bamD, basR, bcsG, bcsZ, bdcA, bdcR, bepA, bfd, bglG, bglH, bglJ, bioA, bioC, birA, blr, bolA, borD, brnQ, bssR, btsR, btuB, btuD, btuE, btuF, c0293, cadC, cas1, cas2, casD, cbpA, cbpM, cbrC, ccp, cdaR, cedA, cfa, chaA, chaB, cheR, chpS, citR, clpA, clpX, clsC, cmk, cmoM, cmtA, cmtB, cnoX, coaD, cobS, cobT, copA, corA, cpxA, cpxP, cpxR, cra, crp, csgC, csgD, csgE, csgF, csgI, cspA, cspD, csqR, csrA, cueO, cueR, cutA, cyaA, cycA, cydB, cysB, cysE, cysT, cytR, dadA, dam, dapE, dcm, dcp, dcyD, ddpA, ddpB, ddpX, deaD, dedA, def, degS, deoA, deoC, deoD, deoR, dgcI, dgcJ, dgcN, dgcQ, dgkA, dgoR, dhaR, dicA, dicC, dicD, dicF, dinB, dinG, dinQ, dkgA, dksA, dld, dnaA, dnaE, dnaG, dnaK, dnaN, dosC, dppC, dppD, dppF, dsbG, dtpB, dusB, dut, eamA, ebgA, ebgR, ecnB, eco, efeO, efp, elfA, elfC, elfG, emrD, eno, entB, entC, entE, entH, envC, envR, envY, epmB, eptB, era, essD, evgA, evgS, exbB, exoX, fabF, fabR, fabZ, fadR, fau, fbaA, fbaB, fdhD, fdoG, fdx, feaR, fecI, fecR, fepA, fes, fhlA, fhuA, fhuB, fhuC, fhuE, fimA, fimE, fimG, fimH, fimZ, fis, fklB, fkpA, fldB, flgA, flgC, flgE, flgH, flgI, flgK, flgM, flgN, flhA, flhB, flhC, flhD, fliA, fliD, fliE, fliM, fliT, fliZ, fmt, fnr, frc, frmA, frmB, frmR, fruK, ftnB, ftsH, ftsK, fumA, fur, gabP, gadC, gadE, gadW, gadX, galR, galS, gapA, gatA, gatB, gatR, gatY, gcd, glaR, glgB, glgC, glgP, glgX, glnG, glnH, glnP, glnQ, glnS, glnU, glnW, glnX, glpG, glpR, glrR, glsB, gltJ, gltX, glyU, glyV, glyX, gmk, gnd, gnsA, gor, gph, gpmA, gpsA, gpt, greB, grpE, grxA, grxB, grxC, gsk, gspA, gspB, gspC, gspF, gspG, gspH, gspJ, gspK, gspL, gutM, hcaR, hchA, hdeD, hdfR, hemA, hemF, hemH, hemN, hflC, hflK, hflX, hinT, hipA, hipB, hisA, hisB, hisC, hisF, hisH, hisJ, hisQ, hns, hofB, hofC, hofM, hofO, hokE, holC, holE, hpf, hprR, hpt, hscA, hslO, hslV, htpX, htrE, hxpA, hypT, ibpA, ibsC, icd, ihfA, ihfB, ileS, ileY, ilvA, ilvB, ilvD, ilvH, ilvI, ilvL, insC5, insD5, insD7, insH3, insN, intA, intD, intQ, intS, intZ, iraM, iscR, iscX, ispB, ispD, ispH, istR, ivy, kbl, kdgR, kdgT, kdpE, kdsB, kdsD, kgtP, lapC, ldcC, ldhA, ldtC, ldtD, leuA, leuC, leuD, leuE, leuL, leuO, leuT, leuV, leuX, lexA, lgt, ligB, lipA, livG, livH, livJ, livK, lldD, lldR, lolB, lon, lptB, lptC, lptM, lpxB, lrhA, lrp, lsrR, lysC, lysO, lysP, lysT, lysW, maeB, malI, maoP, matA, mcrB, mdtG, mdtJ, mdtL, mdtM, mdtU, melR, metG, metJ, metT, metV, metW, metY, metZ, mfd, mgrB, mgtA, mgtS, mhpR, mhpT, micL, mipA, mlc, mlrA, mltA, mnmA, moaA, moaB, moaD, mobA, mocA, modA, modE, mokB, motB, mppA, mqsA, mrdA, mreB, mreC, mrp, mscM, mscS, msyB, mtfA, mtlA, mtlD, mtlR, mukB, mukE, mukF, nac, nadA, nadB, nadE, nadR, nanA, nanQ, nanR, nanY, narL, narU, narV, narW, narY, ndk, nei, nhaR, nimR, nimT, nlpA, nnr, nohA, norR, npr, nrdR, nsrR, nudC, nudE, nupC, nusB, obgE, ompF, ompG, ompN, ompR, oppD, oppF, orn, ortT, osmB, osmE, osmF, osmY, otsA, oxc, oxyR, paaX, pabA, pabC, pagP, pal, panB, panC, panD, panF, panZ, pcm, pdeB, pdeC, pdeR, pdhR, pdxA, pdxJ, pepD, pepE, pepN, pepP, pfkA, pfkB, pgi, pgk, pgl, pgpA, pgpB, pgpC, pgrR, pheM, pheU, pheV, phnC, phnG, phnH, phnI, phnJ, phnN, phnP, phoB, phoE, phoH, phoP, phoQ, phoR, phr, pitB, plaR, pldA, pliG, pncC, pnp, pntA, pntB, pnuC, polA, potE, potF, potI, ppc, ppdC, ppdD, ppiA, ppiB, ppiC, ppiD, ppk, ppx, preT, prfB, priC, prlF, prmC, proL, proM, proP, proS, proV, proX, psd, psiF, pspF, pstA, pstB, pstS, psuG, psuK, pth, ptrR, punC, punR, puuR, pyrB, pyrF, pyrH, pyrI, pyrR, qseB, qseC, queE, queF, racR, ralA, ralR, rarA, ravA, rbn, rcdA, rcdB, rclA, rclB, rclR, rcsA, rcsB, recA, recC, recD, recF, recN, recQ, recR, recX, rep, rfaD, rfaH, rfbB, rfbC, rffH, rffM, rflP, rho, rhsD, rhtA, ridA, rihB, rimM, rlmE, rlmF, rnc, rne, rnr, rnt, rof, rpe, rpiA, rplA, rplU, rplY, rpmA, rpmB, rpoD, rpoE, rpoH, rpoN, rpoS, rpoZ, rpsA, rpsD, rpsO, rpsU, rseA, rseB, rseP, rsgA, rsmG, rspR, rssA, rstA, rsxD, rsxG, rutB, rutC, rutD, rutE, rutG, rutR, ruvA, ruvC, rzpD, sad, safA, sbcC, sbmA, sbmC, scpB, sdaC, sdhD, sdiA, secB, selA, selB, selC, serT, serX, setB, sfmA, sfmC, sfsB, sgcA, sgcB, sgcC, sgcE, sgcQ, sgcR, shoB, sixA, skp, slyA, smg, sodB, sohB, soxR, soxS, speC, speD, speE, speFL, spf, srlR, srmB, ssb, ssnA, sspA, ssrA, ssrS, stpA, sulA, surA, sutR, sxy, tap, tar, tatA, tatB, tdh, tehA, tehB, tfaQ, thiC, thrA, thrB, thrC, thrS, thrU, thrW, tktB, tnaB, tolB, torI, torR, tpr, tpx, treF, trhO, trmA, trmD, trmH, truB, trxA, tsaE, tsuA, tyrR, tyrU, ubiH, ubiI, ugd, ugpA, ugpB, ugpC, ugpE, ugpQ, uhpA, ulaD, ulaF, ulaR, umuD, uof, upp, uraA, uspB, uspG, uvrA, uvrD, uvrY, valT, valU, valW, valY, waaB, waaC, waaG, waaH, waaL, waaP, wcaA, wcaE, wecB, wecE, wrbA, wza, wzc, wzxE, wzyE, xdhA, xdhC, xseB, xtpA, xynR, yaaX, yabI, yabQ, yacC, yadC, yadM, yadN, yadV, yaeF, yafC, yafD, yafO, yafP, yafW, yahE, yahN, yaiS, yaiZ, yajD, yajO, ybaB, ybaT, ybcK, ybdF, ybdK, ybdM, ybdZ, ybeQ, ybeR, ybeX, ybeY, ybfA, ybfC, ybfE, ybgC, ybgE, ybhD, ybhH, ybhI, ybhM, ybiB, ybiJ, ybjI, ybjJ, ybjP, ybjQ, ybjS, ybjX, ycaM, ycbU, ycbV, yccA, yccE, yccJ, yccU, yceJ, ycgV, ycgX, ycgY, ychQ, yciC, yciH, yciT, yciU, yciX, ycjF, ycjG, ycjM, ycjN, ycjO, ycjP, ycjQ, ycjR, ycjS, ycjT, ycjU, ycjV, ycjW, ycjX, ydaS, ydaU, ydaV, ydaW, ydbK, ydcC, ydcO, ydcS, ydcU, ydcV, yddG, ydeA, ydeE, ydeI, ydeJ, ydeO, ydeQ, ydfB, ydfD, ydfI, ydfK, ydfO, ydfR, ydfX, ydgI, ydhI, ydhK, ydhS, ydiB, ydiL, ydiM, ydiO, ydiP, ydjM, yeaD, yeaE, yeaG, yeaH, yeaY, yebC, yebF, yebG, yebQ, yecE, yecT, yeeZ, yegL, yegR, yehD, yehE, yehL, yehS, yehW, yehX, yehY, yeiH, yeiL, yeiP, yeiQ, yeiW, yejG, yfaP, yfbL, yfbN, yfbO, yfbU, yfbV, yfcC, yfcV, yfdC, yfdE, yfdV, yfdX, yfeC, yfeS, yffP, yfgD, yfhL, yfiF, yfiR, yfjD, yfjI, ygaM, ygaP, ygbA, ygbI, ygbJ, ygbK, ygcE, ygcO, ygcP, ygcS, ygcW, ygdR, ygeW, yggE, yghR, yghS, ygiD, ygiF, ygiV, ygiW, ygjH, ygjR, yhaJ, yhaK, yhaL, yhaV, yhbE, yhbY, yhcN, yhcO, yhdV, yhdZ, yhhQ, yhjD, yhjE, yhjG, yhjJ, yhjR, yiaT, yiaU, yiaV, yiaW, yibT, yicH, yidB, yidL, yidQ, yidZ, yieF, yieP, yigG, yihM, yiiE, yiiM, yjaH, yjbB, yjbE, yjbF, yjbQ, yjdP, yjeH, yjeJ, yjfN, yjfY, yjgH, yjgM, yjgN, yjhH, yjiL, yjjP, yjjQ, yjjY, ykfF, ykfG, ykfI, ykgA, ykgH, ykgM, ykgO, ykgR, ymjC, ynaE, ynbA, ynbC, ynbD, yneG, yneK, ynfA, yniB, yoaE, yoaH, yobA, yobB, yobD, yobF, yodB, ypdC, ypjA, yqeB, yqeG, yqeJ, yqeK, yqhC, yqhG, yqiH, yqiI, yqjA, yqjF, yrbG, yrdD, yrdG, yrfG, ytfB, ytfP, ytiD, ytjB, zinT, zipA, zitB, znuC, zraP, zraR, zraS, zur) * P(acrR, adeP, adiY, alpA, ameF, arcA, argP, argR, arnA, arnB, arnC, arnD, arnE, arnF, arnT, atoC, basR, bdcR, bglJ, birA, bolA, btsR, c0293, citR, cpxR, cra, crp, csgD, cspA, csrA, cueO, cueR, cytR, deaD, deoR, dgkA, dicA, dicD, dicF, dksA, dnaA, ebgR, elfC, envR, envY, evgA, fabR, fimZ, fis, flhC, flhD, fliA, fliZ, fnr, frmA, frmR, fur, gadE, gadW, gadX, gatR, glaR, glnG, glrR, glsB, hdfR, hinT, hns, hxpA, hypT, ihfA, ihfB, intA, kdgT, kdpE, leuO, lexA, lldR, lrhA, lrp, matA, mlrA, modE, mppA, mqsA, mrdA, nac, nadA, nadR, nanR, nimR, nimT, norR, nsrR, ompG, ompR, orn, oxyR, pgrR, phoB, phoP, pliG, pnuC, ppiC, priC, ptrR, punR, pyrR, qseB, racR, ralA, rcdA, rclR, rcsA, rcsB, rhsD, rpoD, rpoE, rpoH, rpoN, rpoS, rpsA, rsgA, rstA, rutR, sdiA, selB, sfmA, sfmC, slyA, smg, soxR, soxS, srmB, stpA, sutR, tehA, tehB, torR, ulaR, yadN, ybdM, ybjI, ybjJ, ycbU, ycbV, yccU, ycgY, yciU, ycjG, ycjM, ycjN, ycjO, ycjP, ycjQ, ycjR, ycjS, ycjT, ycjU, ycjV, ycjW, ydaS, ydaV, ydaW, ydeO, ydfI, ydhS, ydiP, yehD, yehS, yfbN, yfbO, yfbU, yfcV, yfdC, yfeC, yfjD, ygbI, ygbJ, ygiD, yhaJ, yhaK, yhaL, yiaT, yiaU, yiaV, yiaW, yidB, yidZ, yigG, yihM, yjdP, yjfY, yjjQ, ynaE, yneG, yodB, ypdC, ypjA, yqhC, yqjF, yrdG, zraR, zur) * P(alpA, ameF, atoC, basR, birA, btsR, c0293, citR, cueR, deoR, dicD, dicF, ebgR, envR, envY, fabR, fimZ, frmR, gatR, glaR, glrR, hypT, kdpE, modE, nadR, nanR, nimR, nsrR, pgrR, ptrR, racR, rcdA, rclR, srmB, ulaR, ycjW, yfeC, ygbI, yhaJ, yiaU, yidZ, zur) * P(atoC, basR, birA, btsR, c0293, cueR, deoR, ebgR, envY, fabR, fimZ, gatR, glaR, glrR, hypT, modE, nanR, nimR, nsrR, pgrR, ptrR, racR, rcdA, rclR, ulaR, ycjW, yfeC, yhaJ, yidZ, zur) * P(basR, btsR, deoR, fimZ, glaR, hypT, modE, nanR, nimR, nsrR, pgrR, ptrR, rcdA, rclR, yfeC, zur) * P(basR, btsR, fimZ, glaR, modE, nimR, nsrR, pgrR, ptrR, rclR, yfeC, zur) * P(basR, glaR, modE, nsrR) * P(basR, glaR, modE, nsrR, ptrR, zur) / P(abgA, abgR, acnB, acrE, acrF, acrR, ada, adeP, adhP, adiA, adiC, adiY, aer, agaR, agp, alaA, alaE, alaS, alaX, allR, alpA, alsR, ameF, amiC, amn, ampC, ampD, ampE, ampH, amyA, apaG, aphA, arcA, arcB, arfB, argA, argD, argE, argG, argH, argK, argP, argR, argV, argW, argX, argY, argZ, arnA, arnB, arnC, arnD, arnE, arnF, arnT, aroA, aroB, aroE, artP, artQ, asd, asnV, aspC, aspS, asr, astA, astD, atoA, atoC, atoE, atpA, atpB, atpD, atpF, atpI, azoR, azuC, bamB, bamD, basR, bcsG, bcsZ, bdcA, bdcR, bepA, bfd, bglG, bglH, bglJ, bioA, bioC, birA, blr, bolA, borD, brnQ, bssR, btsR, btuB, btuD, btuE, btuF, c0293, cadC, cas1, cas2, casD, cbpA, cbpM, cbrC, ccp, cdaR, cedA, cfa, chaA, chaB, cheR, chpS, citR, clpA, clpX, clsC, cmk, cmoM, cmtA, cmtB, cnoX, coaD, cobS, cobT, copA, corA, cpxA, cpxP, cpxR, cra, crp, csgC, csgD, csgE, csgF, csgI, cspA, cspD, csqR, csrA, cueO, cueR, cutA, cyaA, cycA, cydB, cysB, cysE, cysT, cytR, dadA, dam, dapE, dcm, dcp, dcyD, ddpA, ddpB, ddpX, deaD, dedA, def, degS, deoA, deoC, deoD, deoR, dgcI, dgcJ, dgcN, dgcQ, dgkA, dgoR, dhaR, dicA, dicC, dicD, dicF, dinB, dinG, dinQ, dkgA, dksA, dld, dnaA, dnaE, dnaG, dnaK, dnaN, dosC, dppC, dppD, dppF, dsbG, dtpB, dusB, dut, eamA, ebgA, ebgR, ecnB, eco, efeO, efp, elfA, elfC, elfG, emrD, eno, entB, entC, entE, entH, envC, envR, envY, epmB, eptB, era, essD, evgA, evgS, exbB, exoX, fabF, fabR, fabZ, fadR, fau, fbaA, fbaB, fdhD, fdoG, fdx, feaR, fecI, fecR, fepA, fes, fhlA, fhuA, fhuB, fhuC, fhuE, fimA, fimE, fimG, fimH, fimZ, fis, fklB, fkpA, fldB, flgA, flgC, flgE, flgH, flgI, flgK, flgM, flgN, flhA, flhB, flhC, flhD, fliA, fliD, fliE, fliM, fliT, fliZ, fmt, fnr, frc, frmA, frmB, frmR, fruK, ftnB, ftsH, ftsK, fumA, fur, gabP, gadC, gadE, gadW, gadX, galR, galS, gapA, gatA, gatB, gatR, gatY, gcd, glaR, glgB, glgC, glgP, glgX, glnG, glnH, glnP, glnQ, glnS, glnU, glnW, glnX, glpG, glpR, glrR, glsB, gltJ, gltX, glyU, glyV, glyX, gmk, gnd, gnsA, gor, gph, gpmA, gpsA, gpt, greB, grpE, grxA, grxB, grxC, gsk, gspA, gspB, gspC, gspF, gspG, gspH, gspJ, gspK, gspL, gutM, hcaR, hchA, hdeD, hdfR, hemA, hemF, hemH, hemN, hflC, hflK, hflX, hinT, hipA, hipB, hisA, hisB, hisC, hisF, hisH, hisJ, hisQ, hns, hofB, hofC, hofM, hofO, hokE, holC, holE, hpf, hprR, hpt, hscA, hslO, hslV, htpX, htrE, hxpA, hypT, ibpA, ibsC, icd, ihfA, ihfB, ileS, ileY, ilvA, ilvB, ilvD, ilvH, ilvI, ilvL, insC5, insD5, insD7, insH3, insN, intA, intD, intQ, intS, intZ, iraM, iscR, iscX, ispB, ispD, ispH, istR, ivy, kbl, kdgR, kdgT, kdpE, kdsB, kdsD, kgtP, lapC, ldcC, ldhA, ldtC, ldtD, leuA, leuC, leuD, leuE, leuL, leuO, leuT, leuV, leuX, lexA, lgt, ligB, lipA, livG, livH, livJ, livK, lldD, lldR, lolB, lon, lptB, lptC, lptM, lpxB, lrhA, lrp, lsrR, lysC, lysO, lysP, lysT, lysW, maeB, malI, maoP, matA, mcrB, mdtG, mdtJ, mdtL, mdtM, mdtU, melR, metG, metJ, metT, metV, metW, metY, metZ, mfd, mgrB, mgtA, mgtS, mhpR, mhpT, micL, mipA, mlc, mlrA, mltA, mnmA, moaA, moaB, moaD, mobA, mocA, modA, modE, mokB, motB, mppA, mqsA, mrdA, mreB, mreC, mrp, mscM, mscS, msyB, mtfA, mtlA, mtlD, mtlR, mukB, mukE, mukF, nac, nadA, nadB, nadE, nadR, nanA, nanQ, nanR, nanY, narL, narU, narV, narW, narY, ndk, nei, nhaR, nimR, nimT, nlpA, nnr, nohA, norR, npr, nrdR, nsrR, nudC, nudE, nupC, nusB, obgE, ompF, ompG, ompN, ompR, oppD, oppF, orn, ortT, osmB, osmE, osmF, osmY, otsA, oxc, oxyR, paaX, pabA, pabC, pagP, pal, panB, panC, panD, panF, panZ, pcm, pdeB, pdeC, pdeR, pdhR, pdxA, pdxJ, pepD, pepE, pepN, pepP, pfkA, pfkB, pgi, pgk, pgl, pgpA, pgpB, pgpC, pgrR, pheM, pheU, pheV, phnC, phnG, phnH, phnI, phnJ, phnN, phnP, phoB, phoE, phoH, phoP, phoQ, phoR, phr, pitB, plaR, pldA, pliG, pncC, pnp, pntA, pntB, pnuC, polA, potE, potF, potI, ppc, ppdC, ppdD, ppiA, ppiB, ppiC, ppiD, ppk, ppx, preT, prfB, priC, prlF, prmC, proL, proM, proP, proS, proV, proX, psd, psiF, pspF, pstA, pstB, pstS, psuG, psuK, pth, ptrR, punC, punR, puuR, pyrB, pyrF, pyrH, pyrI, pyrR, qseB, qseC, queE, queF, racR, ralA, ralR, rarA, ravA, rbn, rcdA, rcdB, rclA, rclB, rclR, rcsA, rcsB, recA, recC, recD, recF, recN, recQ, recR, recX, rep, rfaD, rfaH, rfbB, rfbC, rffH, rffM, rflP, rho, rhsD, rhtA, ridA, rihB, rimM, rlmE, rlmF, rnc, rne, rnr, rnt, rof, rpe, rpiA, rplA, rplU, rplY, rpmA, rpmB, rpoD, rpoE, rpoH, rpoN, rpoS, rpoZ, rpsA, rpsD, rpsO, rpsU, rseA, rseB, rseP, rsgA, rsmG, rspR, rssA, rstA, rsxD, rsxG, rutB, rutC, rutD, rutE, rutG, rutR, ruvA, ruvC, rzpD, sad, safA, sbcC, sbmA, sbmC, scpB, sdaC, sdhD, sdiA, secB, selA, selB, selC, serT, serX, setB, sfmA, sfmC, sfsB, sgcA, sgcB, sgcC, sgcE, sgcQ, sgcR, shoB, sixA, skp, slyA, smg, sodB, sohB, soxR, soxS, speC, speD, speE, speFL, spf, srlR, srmB, ssb, ssnA, sspA, ssrA, ssrS, stpA, sulA, surA, sutR, sxy, tap, tar, tatA, tatB, tdh, tehA, tehB, tfaQ, thiC, thrA, thrB, thrC, thrS, thrU, thrW, tktB, tnaB, tolB, torI, torR, tpr, tpx, treF, trhO, trmA, trmD, trmH, truB, trxA, tsaE, tsuA, tyrR, tyrU, ubiH, ubiI, ugd, ugpA, ugpB, ugpC, ugpE, ugpQ, uhpA, ulaD, ulaF, ulaR, umuD, uof, upp, uraA, uspB, uspG, uvrA, uvrD, uvrY, valT, valU, valW, valY, waaB, waaC, waaG, waaH, waaL, waaP, wcaA, wcaE, wecB, wecE, wrbA, wza, wzc, wzxE, wzyE, xdhA, xdhC, xseB, xtpA, xynR, yaaX, yabI, yabQ, yacC, yadC, yadM, yadN, yadV, yaeF, yafC, yafD, yafO, yafP, yafW, yahE, yahN, yaiS, yaiZ, yajD, yajO, ybaB, ybaT, ybcK, ybdF, ybdK, ybdM, ybdZ, ybeQ, ybeR, ybeX, ybeY, ybfA, ybfC, ybfE, ybgC, ybgE, ybhD, ybhH, ybhI, ybhM, ybiB, ybiJ, ybjI, ybjJ, ybjP, ybjQ, ybjS, ybjX, ycaM, ycbU, ycbV, yccA, yccE, yccJ, yccU, yceJ, ycgV, ycgX, ycgY, ychQ, yciC, yciH, yciT, yciU, yciX, ycjF, ycjG, ycjM, ycjN, ycjO, ycjP, ycjQ, ycjR, ycjS, ycjT, ycjU, ycjV, ycjW, ycjX, ydaS, ydaU, ydaV, ydaW, ydbK, ydcC, ydcO, ydcS, ydcU, ydcV, yddG, ydeA, ydeE, ydeI, ydeJ, ydeO, ydeQ, ydfB, ydfD, ydfI, ydfK, ydfO, ydfR, ydfX, ydgI, ydhI, ydhK, ydhS, ydiB, ydiL, ydiM, ydiO, ydiP, ydjM, yeaD, yeaE, yeaG, yeaH, yeaY, yebC, yebF, yebG, yebQ, yecE, yecT, yeeZ, yegL, yegR, yehD, yehE, yehL, yehS, yehX, yehY, yeiH, yeiL, yeiP, yeiQ, yeiW, yejG, yfaP, yfbL, yfbN, yfbO, yfbU, yfbV, yfcC, yfcV, yfdC, yfdE, yfdV, yfdX, yfeC, yfeS, yffP, yfgD, yfhL, yfiF, yfiR, yfjD, yfjI, ygaM, ygaP, ygbA, ygbI, ygbJ, ygbK, ygcE, ygcO, ygcP, ygcS, ygcW, ygdR, ygeW, yggE, yghR, yghS, ygiD, ygiF, ygiV, ygiW, ygjH, ygjR, yhaJ, yhaK, yhaL, yhaV, yhbE, yhbY, yhcN, yhcO, yhdV, yhdZ, yhhQ, yhjD, yhjE, yhjG, yhjJ, yhjR, yiaT, yiaU, yiaV, yiaW, yibT, yicH, yidB, yidL, yidQ, yidZ, yieF, yieP, yigG, yihM, yiiE, yiiM, yjaH, yjbB, yjbE, yjbF, yjbQ, yjdP, yjeH, yjeJ, yjfN, yjfY, yjgH, yjgM, yjgN, yjhH, yjiL, yjjP, yjjQ, yjjY, ykfF, ykfG, ykfI, ykgA, ykgH, ykgM, ykgO, ykgR, ymjC, ynaE, ynbA, ynbC, ynbD, yneG, yneK, ynfA, yniB, yoaE, yoaH, yobA, yobB, yobD, yobF, yodB, ypdC, ypjA, yqeB, yqeG, yqeJ, yqeK, yqhC, yqhG, yqiH, yqiI, yqjA, yqjF, yrbG, yrdD, yrdG, yrfG, ytfB, ytfP, ytiD, ytjB, zinT, zipA, zitB, znuC, zraP, zraR, zraS, zur) * P(adeP, alpA, ameF, arnA, arnB, arnC, arnD, arnE, arnF, arnT, atoC, basR, bdcR, birA, btsR, c0293, citR, cueO, cueR, deoR, dgkA, dicA, dicD, dicF, ebgR, elfC, envR, envY, fabR, fimZ, frmA, frmR, gatR, glaR, glrR, glsB, hinT, hxpA, hypT, intA, kdgT, kdpE, modE, mppA, mrdA, nadA, nadR, nanR, nimR, nimT, norR, nsrR, ompG, orn, pgrR, pliG, pnuC, ppiC, priC, ptrR, punR, pyrR, racR, ralA, rcdA, rclR, rhsD, rsgA, selB, sfmA, sfmC, smg, srmB, tehA, tehB, ulaR, yadN, ybdM, ybjI, ybjJ, ycbU, ycbV, yccU, ycgY, yciU, ycjG, ycjM, ycjN, ycjO, ycjP, ycjQ, ycjR, ycjS, ycjT, ycjU, ycjV, ycjW, ydaS, ydaV, ydaW, ydfI, ydhS, yehD, yehS, yfbN, yfbO, yfbU, yfcV, yfdC, yfeC, yfjD, ygbI, ygbJ, ygiD, yhaJ, yhaK, yhaL, yiaT, yiaU, yiaV, yiaW, yidB, yidZ, yigG, yihM, yjdP, yjfY, ynaE, yneG, yodB, ypdC, ypjA, yqhC, yqjF, yrdG, zur) * P(ameF, atoC, basR, birA, btsR, c0293, citR, cueR, deoR, dicD, dicF, ebgR, envR, envY, fabR, fimZ, frmR, gatR, glaR, glrR, hypT, kdpE, modE, nadR, nanR, nimR, nsrR, pgrR, ptrR, racR, rcdA, rclR, srmB, ulaR, ycjW, yfeC, ygbI, yhaJ, yiaU, yidZ, zur) * P(atoC, basR, birA, btsR, c0293, cueR, deoR, ebgR, envY, fabR, fimZ, gatR, glaR, hypT, modE, nanR, nimR, nsrR, pgrR, ptrR, racR, rcdA, rclR, ulaR, ycjW, yfeC, yhaJ, yidZ, zur) * P(basR, btsR, deoR, fimZ, glaR, hypT, modE, nanR, nimR, nsrR, pgrR, ptrR, rclR, yfeC, zur) * P(basR, fimZ, glaR, modE, nimR, nsrR, pgrR, ptrR, rclR, yfeC, zur) * P(basR, glaR, modE, nsrR, zur) * P(glaR, modE)))",
